{
  "schema_id": "urn:wildclawbench:schema:general-e2e:execution-record:v1",
  "schema_version": 1,
  "identity": {
    "batch_id": "general-g2-02-s1-macos-20260917-224935",
    "unit_id": "astronstudio-macos-x86-64",
    "task_id": "02_Code_Intelligence_task_001_temperature_cli_fix",
    "attempt_id": "693c1c28-a78a-409b-82d7-b0dfcadb3132"
  },
  "dataset": {
    "id": "general-custom60-v1",
    "digest": "119568a06a100461445c92544ca4c90e0c5c70fba49711a0fd915a6c708f1d0a"
  },
  "phase": "COMPLETED",
  "harness": {
    "id": "astronstudio",
    "platform": "macos-x86-64",
    "version": "3.3.1"
  },
  "model": {
    "requested_id": "GLM-5.2",
    "actual_id": "GLM-5.2",
    "reasoning_effort": "High",
    "verification_status": "verified"
  },
  "execution": {
    "business_status": "completed",
    "started_at": "2026-09-17T14:51:41.541Z",
    "finished_at": "2026-09-17T14:52:30.547Z",
    "duration_seconds": 49.006,
    "agent_duration_seconds": 32.476,
    "error": null
  },
  "prompt": {
    "sha256": "455f6e3fc79fa77d6d7ab98e43b93baee8e4f946c025bc2a118c943073c05c0b",
    "send_status": "sent",
    "sent_at": "2026-09-17T14:51:51.671Z"
  },
  "session": {
    "thread_id": "1fc7cf29-ec97-41ab-8264-51d23cc86bc5",
    "turn_id": "01a0afda-4a76-79a2-887a-09cc22592523",
    "session_id": "01a0afda-3943-74b1-99a1-86fefb8e2f67",
    "cwd": "/Users/gzx/Project/GitHub/xgz/ai/evaluate/WildClawBench/WildClawBench/report-workspace/general-e2e/g2-02/worker-s1/unit/general-g2-02-s1-macos-20260917-224935__astronstudio-macos-x86-64/execution/tasks/02_Code_Intelligence_task_001_temperature_cli_fix/workspace",
    "verified": true
  },
  "evidence": {
    "completeness": "complete",
    "transcript_path": "evidence/tasks/02_Code_Intelligence_task_001_temperature_cli_fix/693c1c28-a78a-409b-82d7-b0dfcadb3132/trace/transcript.jsonl",
    "trace_index_path": "evidence/tasks/02_Code_Intelligence_task_001_temperature_cli_fix/693c1c28-a78a-409b-82d7-b0dfcadb3132/trace/trace-index.json",
    "final_response_path": "evidence/tasks/02_Code_Intelligence_task_001_temperature_cli_fix/693c1c28-a78a-409b-82d7-b0dfcadb3132/final-response.md",
    "missing": []
  },
  "candidate": {
    "path": "evidence/tasks/02_Code_Intelligence_task_001_temperature_cli_fix/693c1c28-a78a-409b-82d7-b0dfcadb3132/candidate/workspace",
    "frozen_sha256": "87cf47353206e9ceb4c4d9bb67a4326bc76ef7376cf26b03c82da5514362e070",
    "frozen_at": "2026-09-17T17:17:33.426Z",
    "drift_status": "stable"
  },
  "resource_metrics_path": "evidence/tasks/02_Code_Intelligence_task_001_temperature_cli_fix/693c1c28-a78a-409b-82d7-b0dfcadb3132/resource-metrics.json",
  "human_assistance": {
    "mode": "automatic",
    "operation_count": 0,
    "semantic_intervention_count": 0
  }
}
